{
    "$schema": "https://json-schema.org/draft/2020-12/schema",
    "$id": "https://dfc/schemas/misc/counts_as_entry.json",
    "title": "DFC 'Counts As' Ship Entry",
    "description": "Data file for a ship class that counts as an existing class from one of the fleet PDFs.",
    "type": "object",
    "required": [
        "Fleet",
        "Class",
        "Type",
        "RuleName",
        "RuleText",
        "KnownShips",
        "Flavour",
        "CountsAsClass",
        "CountsAsType",
        "Availability"
    ],
    "additionalProperties": false,
    "properties": {
        "Fleet": {
            "description": "Fleet the counts-as class belongs to.",
            "type": "string"
        },
        "Class": {
            "description": "Name of this ship class.",
            "type": "string"
        },
        "Type": {
            "description": "Ship type (e.g. 'Light Cruiser'). Typically matches counts_as_type in practice.",
            "type": "string"
        },
        "RuleName": {
            "description": "Rule heading (e.g. 'Counts As', 'Kalium KNC-5', 'Remnant').",
            "type": "string"
        },
        "RuleText": {
            "description": "Full 'counts as' sentence from the PDF.",
            "type": "string"
        },
        "KnownShips": {
            "description": "Named individual ships of this class. Often empty.",
            "type": "array",
            "items": { "type": "string" }
        },
        "Flavour": {
            "description": "Flavour text. Often empty. Paragraph breaks encoded as \\n.",
            "type": "string"
        },
        "CountsAsClass": {
            "description": "Class name this ship counts as, resolved from fleet data.",
            "type": "string"
        },
        "CountsAsType": {
            "description": "Ship type of the counts-as class, taken from fleet data.",
            "type": "string"
        },
        "Availability": {
            "description": "How the model is obtained.",
            "type": "string",
            "enum": ["RESIN", "EXCLUSIVE"]
        }
    }
}
