{
    "Fleet": "UCM",
    "Class": "Athens",
    "Type": "Light Cruiser",
    "RuleName": "Counts As",
    "RuleText": "This ship counts as an Osaka Light Cruiser.",
    "KnownShips": [],
    "Flavour": "",
    "CountsAsClass": "Osaka",
    "CountsAsType": "Light Cruiser",
    "Availability": "EXCLUSIVE"
}