{
    "Fleet": "Resistance",
    "Class": "Myrmidon",
    "Type": "Battleship",
    "RuleName": "Counts As",
    "RuleText": "This ship counts as a Barbarossa Grand Battleship.",
    "KnownShips": [],
    "Flavour": "",
    "CountsAsClass": "Barbarossa",
    "CountsAsType": "Grand Battleship",
    "Availability": "RESIN"
}