{
    "Fleet": "Resistance",
    "Class": "Olympus",
    "Type": "Battleship",
    "RuleName": "Counts As",
    "RuleText": "This ship counts as a Yi Sun-sin Grand Battleship.",
    "KnownShips": [],
    "Flavour": "",
    "CountsAsClass": "Yi Sun-sin",
    "CountsAsType": "Grand Battleship",
    "Availability": "RESIN"
}