{
    "Fleet": "Resistance",
    "Class": "Centurion",
    "Type": "Grand Cruiser",
    "RuleName": "Remnant",
    "RuleText": "This Ship counts as a Resistance Centurion Heavy Cruiser but may be used in UCM or PHR fleets in addition to Resistance fleets. In UCM and PHR fleets, they follow the same rules as the Resistance Centurion but gain the Rare special rule.",
    "KnownShips": [
        "Pilum",
        "Fontaine's Miracle",
        "Myriad (Independents)",
        "Proudcore",
        "Industry",
        "Fist of Iron (Kalium)"
    ],
    "Flavour": "The Centurion was the most common standardised vessel of cruiser tonnage in the pre-war EAA Terran Grand Fleet. In those days the definition of Cruiser was somewhat broader; today, such a bulky vessel is designated as a Grand Cruiser, a classification not really in use with the UCMF. In bulk (though not in firepower), it is more akin to a modern Heavy Cruiser. It has truly excellent ceramic armour plating that outclasses all but defence monitors in the modern UCMF. The Centurion also features many of the typical advantages and disadvantages of vintage naval architecture. Originally manufactured by Trident Industrial over Olympus Prime, the design was soon licensed to Earth-based Equatorial Yards Inc. Only the licensed Earth pattern is still built today, by Kalium, though it also operates legacy Olympus Centurions.\nIts simple but effective all-gun primary armament provides an excellent blend of destructive power and reliability. The class requires low weapon maintenance - a welcome factor that certainly isn't the case with some of the more esoteric and experimental armaments in mankind's pre-war arsenal.\nIts primary armament is broadsides of transition mass drivers, alongside an oversized twin pure mass driver turret, more in keeping with modern UCMF gunnery, albeit with much heavier projectiles.",
    "CountsAsClass": "Centurion",
    "CountsAsType": "Grand Cruiser",
    "Availability": "EXCLUSIVE"
}